{
  "format": "drawio-review-site/v1",
  "generator": "drawio-diagram-engineer",
  "tool_version": "1.5.0",
  "title": "example-blueprint",
  "source_bundle": "bundle",
  "provenance": {
    "revision": "bda3ac3127fd997a9f216085cbf8cd852a791162b3ecab5ff84ebc5dae4d4e65",
    "revision_type": "bundle",
    "repository": null,
    "source_url": null,
    "source_path": "architecture/commerce-platform.json",
    "bundle_sha256": "bda3ac3127fd997a9f216085cbf8cd852a791162b3ecab5ff84ebc5dae4d4e65",
    "artifacts": {
      "audit.json": "af6d7d92b0510e5696133f66e1c9208754d24c360b3d0c240b74f69631af55ca",
      "bundle.json": "ceafde3aa2d26ba2ba0448670607bb90b17cd62edfd6563fee1bcce26b5b2544",
      "diagram.json": "087fca45c9f73420f9e29f0cb4463c9350d3c4857c45f44f19c4ee38b322321b",
      "example-blueprint.drawio": "9b80ff67a9bc072088934bfaf35cf6409f7d78fb24c2b7cb979bcb1ce518a5d7",
      "previews/context.svg": "84bf2290fb2f8e22552ec6dc67e6f1af6e13578eb70668883ea2d500c55810d0",
      "previews/data.svg": "58b04d0300b5f0bd5f3ad93b9bb0746b86340149218ac695d447eec538aefb63",
      "previews/decisions.svg": "35d5b051d095136e824767577a6c01467c6479e445719771c2391acb83bc7d09",
      "previews/deployment.svg": "4b67f052b7242486a782a8bfc50989146875aae96b1c9a1badf11f38f40bd891",
      "previews/logical.svg": "594cfc6cf24ec82c077eaf1fb9231b4d175d3a7f0597372e950edd4fb971e6f2",
      "previews/security.svg": "3cad69ba128bdafaf8082717ff3bf3a38417a7af7f3f115fcc88b7fbc1fa54bb",
      "security.json": "2544d558aff75299579dfc39ae03453a6568471944cbbfdc0bdf79f50efa30cd"
    }
  },
  "pages": [
    {
      "id": "context",
      "title": "Commerce Platform — System Context",
      "artifact": "pages/context.svg",
      "sha256": "84bf2290fb2f8e22552ec6dc67e6f1af6e13578eb70668883ea2d500c55810d0",
      "nodes": 3,
      "edges": 2,
      "groups": 0
    },
    {
      "id": "logical",
      "title": "Commerce Platform — Logical Architecture",
      "artifact": "pages/logical.svg",
      "sha256": "594cfc6cf24ec82c077eaf1fb9231b4d175d3a7f0597372e950edd4fb971e6f2",
      "nodes": 7,
      "edges": 6,
      "groups": 4
    },
    {
      "id": "data",
      "title": "Commerce Platform — Data Flow",
      "artifact": "pages/data.svg",
      "sha256": "58b04d0300b5f0bd5f3ad93b9bb0746b86340149218ac695d447eec538aefb63",
      "nodes": 4,
      "edges": 3,
      "groups": 3
    },
    {
      "id": "deployment",
      "title": "Commerce Platform — Deployment",
      "artifact": "pages/deployment.svg",
      "sha256": "4b67f052b7242486a782a8bfc50989146875aae96b1c9a1badf11f38f40bd891",
      "nodes": 8,
      "edges": 5,
      "groups": 3
    },
    {
      "id": "security",
      "title": "Commerce Platform — Network & Security Zones",
      "artifact": "pages/security.svg",
      "sha256": "3cad69ba128bdafaf8082717ff3bf3a38417a7af7f3f115fcc88b7fbc1fa54bb",
      "nodes": 7,
      "edges": 6,
      "groups": 4
    },
    {
      "id": "decisions",
      "title": "Commerce Platform — Architecture Decisions",
      "artifact": "pages/decisions.svg",
      "sha256": "35d5b051d095136e824767577a6c01467c6479e445719771c2391acb83bc7d09",
      "nodes": 6,
      "edges": 4,
      "groups": 0
    }
  ],
  "catalog": [
    {
      "id": "context",
      "title": "Commerce Platform — System Context",
      "cells": [
        {
          "id": "customer",
          "anchor": "node-customer",
          "category": "node",
          "label": "Customer",
          "href": "pages/context.svg#node-customer"
        },
        {
          "id": "commerce",
          "anchor": "node-commerce",
          "category": "node",
          "label": "Commerce Platform",
          "href": "pages/context.svg#node-commerce"
        },
        {
          "id": "payment",
          "anchor": "node-payment",
          "category": "node",
          "label": "Payment Provider",
          "href": "pages/context.svg#node-payment"
        },
        {
          "id": "customer-web",
          "anchor": "edge-customer-web",
          "category": "edge",
          "label": "HTTPS",
          "href": "pages/context.svg#edge-customer-web"
        },
        {
          "id": "orders-payment",
          "anchor": "edge-orders-payment",
          "category": "edge",
          "label": "charges",
          "href": "pages/context.svg#edge-orders-payment"
        }
      ]
    },
    {
      "id": "logical",
      "title": "Commerce Platform — Logical Architecture",
      "cells": [
        {
          "id": "group-domain-data",
          "anchor": "group-group-domain-data",
          "category": "group",
          "label": "Data",
          "href": "pages/logical.svg#group-group-domain-data"
        },
        {
          "id": "group-domain-experience",
          "anchor": "group-group-domain-experience",
          "category": "group",
          "label": "Experience",
          "href": "pages/logical.svg#group-group-domain-experience"
        },
        {
          "id": "group-domain-orders",
          "anchor": "group-group-domain-orders",
          "category": "group",
          "label": "Orders",
          "href": "pages/logical.svg#group-group-domain-orders"
        },
        {
          "id": "group-domain-platform",
          "anchor": "group-group-domain-platform",
          "category": "group",
          "label": "Platform",
          "href": "pages/logical.svg#group-group-domain-platform"
        },
        {
          "id": "customer",
          "anchor": "node-customer",
          "category": "node",
          "label": "Customer",
          "href": "pages/logical.svg#node-customer"
        },
        {
          "id": "web",
          "anchor": "node-web",
          "category": "node",
          "label": "Web App",
          "href": "pages/logical.svg#node-web"
        },
        {
          "id": "api",
          "anchor": "node-api",
          "category": "node",
          "label": "API Gateway",
          "href": "pages/logical.svg#node-api"
        },
        {
          "id": "orders",
          "anchor": "node-orders",
          "category": "node",
          "label": "Order Service",
          "href": "pages/logical.svg#node-orders"
        },
        {
          "id": "events",
          "anchor": "node-events",
          "category": "node",
          "label": "Order Events",
          "href": "pages/logical.svg#node-events"
        },
        {
          "id": "orders-db",
          "anchor": "node-orders-db",
          "category": "node",
          "label": "Orders DB",
          "href": "pages/logical.svg#node-orders-db"
        },
        {
          "id": "payment",
          "anchor": "node-payment",
          "category": "node",
          "label": "Payment Provider",
          "href": "pages/logical.svg#node-payment"
        },
        {
          "id": "customer-web",
          "anchor": "edge-customer-web",
          "category": "edge",
          "label": "HTTPS",
          "href": "pages/logical.svg#edge-customer-web"
        },
        {
          "id": "web-api",
          "anchor": "edge-web-api",
          "category": "edge",
          "label": "JSON/HTTPS",
          "href": "pages/logical.svg#edge-web-api"
        },
        {
          "id": "api-orders",
          "anchor": "edge-api-orders",
          "category": "edge",
          "label": "commands",
          "href": "pages/logical.svg#edge-api-orders"
        },
        {
          "id": "orders-store",
          "anchor": "edge-orders-store",
          "category": "edge",
          "label": "reads/writes",
          "href": "pages/logical.svg#edge-orders-store"
        },
        {
          "id": "orders-events",
          "anchor": "edge-orders-events",
          "category": "edge",
          "label": "OrderCreated",
          "href": "pages/logical.svg#edge-orders-events"
        },
        {
          "id": "orders-payment",
          "anchor": "edge-orders-payment",
          "category": "edge",
          "label": "charges",
          "href": "pages/logical.svg#edge-orders-payment"
        }
      ]
    },
    {
      "id": "data",
      "title": "Commerce Platform — Data Flow",
      "cells": [
        {
          "id": "group-domain-data",
          "anchor": "group-group-domain-data",
          "category": "group",
          "label": "Data",
          "href": "pages/data.svg#group-group-domain-data"
        },
        {
          "id": "group-domain-orders",
          "anchor": "group-group-domain-orders",
          "category": "group",
          "label": "Orders",
          "href": "pages/data.svg#group-group-domain-orders"
        },
        {
          "id": "group-domain-platform",
          "anchor": "group-group-domain-platform",
          "category": "group",
          "label": "Platform",
          "href": "pages/data.svg#group-group-domain-platform"
        },
        {
          "id": "orders",
          "anchor": "node-orders",
          "category": "node",
          "label": "Order Service",
          "href": "pages/data.svg#node-orders"
        },
        {
          "id": "events",
          "anchor": "node-events",
          "category": "node",
          "label": "Order Events",
          "href": "pages/data.svg#node-events"
        },
        {
          "id": "orders-db",
          "anchor": "node-orders-db",
          "category": "node",
          "label": "Orders DB",
          "href": "pages/data.svg#node-orders-db"
        },
        {
          "id": "payment",
          "anchor": "node-payment",
          "category": "node",
          "label": "Payment Provider",
          "href": "pages/data.svg#node-payment"
        },
        {
          "id": "orders-store",
          "anchor": "edge-orders-store",
          "category": "edge",
          "label": "reads/writes",
          "href": "pages/data.svg#edge-orders-store"
        },
        {
          "id": "orders-events",
          "anchor": "edge-orders-events",
          "category": "edge",